{
  "customer": "Dana Kim",
  "line_items": [
    { "item": "logo redesign", "quantity": 1, "unit_price": 450, "total": 450 },
    { "item": "business cards (500ct)", "quantity": 1, "unit_price": 120, "total": 120 }
  ],
  "subtotal": 570,
  "notes": "A website isn't on the price sheet, so it's not included — let Dana know if that should be quoted separately."
}
